{
  "$schema": "./v3-execution-sequence.schema.json",
  "contract_version": 1,
  "planning_status": "c0_public_baseline",
  "updated_at": "2026-08-25",
  "current_frontier": ["BRG-003", "BRG-017"],
  "batches": [
    {
      "id": "B04a",
      "title": "Operational setup separation",
      "depends_on": [],
      "tasks": ["BRG-014"]
    },
    {
      "id": "B04b",
      "title": "Binding and config hardening",
      "depends_on": ["B04a"],
      "tasks": ["BRG-003", "BRG-017"]
    },
    {
      "id": "B04c",
      "title": "Bridge inventories and exact artifacts",
      "depends_on": ["B04b"],
      "tasks": ["BRG-019"]
    },
    {
      "id": "B05a",
      "title": "Writer compatibility inventory",
      "depends_on": ["B04c"],
      "tasks": ["MIG-001"]
    },
    {
      "id": "B06",
      "title": "Compatibility gate",
      "depends_on": ["B05a"],
      "tasks": ["GATE-B"]
    },
    {
      "id": "B07a",
      "title": "Bounded observation shadow",
      "depends_on": ["B06"],
      "tasks": ["OBS-001"]
    },
    {
      "id": "B07b",
      "title": "Outcome attribution",
      "depends_on": ["B07a"],
      "tasks": ["OUT-001"]
    },
    {
      "id": "B08a",
      "title": "Governed deterministic consolidation",
      "depends_on": ["B07b"],
      "tasks": ["CON-001"]
    },
    {
      "id": "B08b",
      "title": "Reviewed memory forms",
      "depends_on": ["B08a"],
      "tasks": ["MEM-001"]
    },
    {
      "id": "B20",
      "title": "Future V3 onboarding",
      "depends_on": ["B06"],
      "tasks": ["ONB-001"]
    }
  ],
  "tasks": [
    {
      "id": "BRG-014",
      "batch": "B04a",
      "title": "Separate operational setup from durable onboarding",
      "status": "complete",
      "depends_on": [],
      "evidence": [
        "scripts/onboarding.py",
        "tests/test_onboarding.py",
        "docs/install.md"
      ],
      "external_readback_required": false
    },
    {
      "id": "BRG-019",
      "batch": "B04c",
      "title": "Generate bridge inventories and exact-artifact checks",
      "status": "pending",
      "depends_on": ["BRG-003", "BRG-017"],
      "evidence": [],
      "external_readback_required": false
    },
    {
      "id": "BRG-003",
      "batch": "B04b",
      "title": "Make vault binding explicit and deterministic",
      "status": "in_progress",
      "depends_on": ["BRG-014"],
      "evidence": [
        "ai_dememory_tool/cli.py",
        "ai_dememory_tool/vault_binding.py",
        "mcp/server/memory_mcp.py",
        "scripts/config_file.py",
        "scripts/http_api.py",
        "scripts/hook_event.py",
        "scripts/onboarding.py",
        "scripts/provider_import.py",
        "scripts/setup_plan.py",
        "scripts/maintenance.py",
        "scripts/review_memory.py",
        "scripts/schedule_memory.py",
        "scripts/install_smoke.py",
        "tests/test_config_file.py",
        "tests/test_memory_tools.py",
        "tests/test_onboarding.py",
        "tests/test_mcp_profiles.py",
        "tests/test_harness_hooks.py",
        "tests/test_vault_binding.py",
        "tests/test_runtime_binding_help.py"
      ],
      "external_readback_required": false
    },
    {
      "id": "BRG-017",
      "batch": "B04b",
      "title": "Enforce strict configuration parsing and diagnostics",
      "status": "in_progress",
      "depends_on": ["BRG-014"],
      "evidence": [],
      "external_readback_required": false
    },
    {
      "id": "MIG-001",
      "batch": "B05a",
      "title": "Freeze and generate the canonical writer inventory",
      "status": "pending",
      "depends_on": ["BRG-003", "BRG-017", "BRG-019"],
      "evidence": [],
      "external_readback_required": false
    },
    {
      "id": "GATE-B",
      "batch": "B06",
      "title": "Demonstrate V2 compatibility before migration",
      "status": "blocked",
      "depends_on": ["MIG-001"],
      "evidence": [],
      "external_readback_required": true
    },
    {
      "id": "OBS-001",
      "batch": "B07a",
      "title": "Add a bounded provider-neutral observation shadow",
      "status": "future",
      "depends_on": ["GATE-B"],
      "evidence": [],
      "external_readback_required": true
    },
    {
      "id": "OUT-001",
      "batch": "B07b",
      "title": "Link outcomes to exact traces without exposure rewards",
      "status": "future",
      "depends_on": ["OBS-001"],
      "evidence": [],
      "external_readback_required": true
    },
    {
      "id": "CON-001",
      "batch": "B08a",
      "title": "Materialize governed learning candidates deterministically",
      "status": "future",
      "depends_on": ["OUT-001"],
      "evidence": [],
      "external_readback_required": false
    },
    {
      "id": "MEM-001",
      "batch": "B08b",
      "title": "Add reviewed semantic and advisory procedural memory forms",
      "status": "future",
      "depends_on": ["CON-001"],
      "evidence": [],
      "external_readback_required": true
    },
    {
      "id": "ONB-001",
      "batch": "B20",
      "title": "Build V3 guided onboarding",
      "status": "future",
      "depends_on": ["GATE-B"],
      "evidence": [],
      "external_readback_required": true
    }
  ]
}
